review_id,product_category,rating,sentiment_label,review_text,date
1347,sạc dự phòng,5,positive,"săn sale nên thấy dùng ổn định, rất hài lòng",2026-03-31
1348,chuột,4,positive,"shop giao nhanh, pin trâu, dùng mượt cả ngày, hơi tiếc",2025-02-20
1349,chuột,3,neutral,"săn sale nên thấy đúng mô tả, hiệu năng bình thường, sẽ ủng hộ tiếp",2025-10-01
1350,giày thể thao,4,positive,"đế bám tốt, chạy thích, đáng tiền",2026-04-02
1351,nồi chiên,3,neutral,"nấu được nhưng không quá nhanh, hơi tiếc",2025-02-04
1352,áo thun,4,positive,"đóng gói cẩn thận, màu đẹp như hình, sẽ ủng hộ tiếp",2025-05-29
1353,chuột,3,neutral,"săn sale nên thấy đúng mô tả, hiệu năng bình thường, hơi tiếc",2025-12-17
1354,sạc dự phòng,3,neutral,"sạc ở mức bình thường, hơi tiếc",2025-10-15
1355,nồi chiên,5,positive,"nướng nhanh, chín đều, sẽ ủng hộ tiếp",2025-10-20
1356,bàn phím,2,negative,"gõ hơi cứng và ồn, đáng tiền",2025-06-05
1357,nồi chiên,5,positive,"shop giao nhanh, nướng nhanh, chín đều",2025-10-01
1358,bàn phím,4,positive,"đóng gói cẩn thận, gõ êm tay, led đẹp",2025-11-25
1359,bàn phím,3,neutral,"đóng gói cẩn thận, gõ ổn, chưa có gì nổi bật",2025-07-08
1360,tai nghe,5,positive,"đeo êm tai lâu không đau, đáng tiền",2025-06-16
1361,chuột,2,negative,"đóng gói cẩn thận, pin yếu hơn mô tả, sẽ ủng hộ tiếp",2025-05-12
1362,chuột,2,negative,"con lăn bị kẹt, trải nghiệm tệ",2025-04-16
1363,nồi chiên,5,positive,"nướng nhanh, chín đều, hơi tiếc",2025-03-21
1364,áo thun,5,positive,"săn sale nên thấy vải mềm, form đẹp",2025-09-11
1365,bàn phím,4,positive,"săn sale nên thấy keycap chắc chắn, build ngon, sẽ ủng hộ tiếp",2025-11-28
1366,tai nghe,4,positive,"đeo êm tai lâu không đau, sẽ ủng hộ tiếp",2025-02-05
1367,bàn phím,4,positive,"săn sale nên thấy keycap chắc chắn, build ngon",2026-01-06
1368,sạc dự phòng,4,positive,"săn sale nên thấy thiết kế đẹp, cầm chắc tay",2025-02-26
1369,nồi chiên,4,positive,"nướng nhanh, chín đều, đáng tiền",2025-03-15
1370,giày thể thao,1,negative,"đóng gói cẩn thận, size không chuẩn",2025-04-14
1371,bàn phím,5,positive,"đóng gói cẩn thận, switch phản hồi tốt, rất thích, hơi tiếc",2025-03-21
1372,bàn phím,5,positive,"gõ êm tay, led đẹp",2025-10-06
1373,tai nghe,5,positive,"shop giao nhanh, âm thanh rõ, bass tốt",2025-04-27
1374,áo thun,5,positive,"săn sale nên thấy vải mềm, form đẹp",2025-09-09
1375,bàn phím,3,neutral,"đóng gói cẩn thận, đúng mô tả nhưng giao hơi lâu",2025-11-12
1376,tai nghe,4,positive,"shop giao nhanh, mic thu âm rõ, gọi điện tốt, sẽ ủng hộ tiếp",2025-08-08
1377,sạc dự phòng,4,positive,"đóng gói cẩn thận, sạc nhanh, pin đúng dung lượng",2026-02-23
1378,tai nghe,4,positive,"đóng gói cẩn thận, đeo êm tai lâu không đau, đáng tiền",2026-02-20
1379,giày thể thao,3,neutral,"shop giao nhanh, chất lượng bình thường, đáng tiền",2025-03-17
1380,áo thun,5,positive,"vải mềm, form đẹp, hơi tiếc",2026-01-08
1381,tai nghe,5,positive,"săn sale nên thấy âm thanh rõ, bass tốt, đáng tiền",2025-06-13
1382,áo thun,5,positive,"shop giao nhanh, vải mềm, form đẹp, hơi tiếc",2025-08-03
1383,sạc dự phòng,5,positive,"thiết kế đẹp, cầm chắc tay",2026-01-02
1384,áo thun,1,negative,"đóng gói cẩn thận, size bị lệch, mặc không vừa",2025-04-15
1385,nồi chiên,5,positive,"nướng nhanh, chín đều, đáng tiền",2025-07-04
1386,nồi chiên,3,neutral,"shop giao nhanh, nấu được nhưng không quá nhanh",2025-08-04
1387,bàn phím,4,positive,"shop giao nhanh, keycap chắc chắn, build ngon",2025-12-23
1388,giày thể thao,4,positive,"đế bám tốt, chạy thích",2025-12-06
1389,sạc dự phòng,4,positive,"đóng gói cẩn thận, sạc nhanh, pin đúng dung lượng, sẽ ủng hộ tiếp",2025-02-10
1390,bàn phím,5,positive,"săn sale nên thấy gõ êm tay, led đẹp, sẽ ủng hộ tiếp",2026-01-19
1391,sạc dự phòng,2,negative,"đóng gói cẩn thận, dung lượng không như quảng cáo, hơi tiếc",2026-02-05
1392,giày thể thao,1,negative,keo dán chưa chắc,2025-11-06
1393,nồi chiên,4,positive,"săn sale nên thấy máy chạy êm, dễ vệ sinh, hơi tiếc",2025-10-11
1394,giày thể thao,3,neutral,"shop giao nhanh, mẫu đẹp nhưng chưa thử chạy lâu, đáng tiền",2025-02-17
1395,sạc dự phòng,4,positive,"thiết kế đẹp, cầm chắc tay",2025-04-23
1396,áo thun,4,positive,"đóng gói cẩn thận, mặc thoải mái, đường may chắc, hơi tiếc",2026-02-28
1397,áo thun,5,positive,"đóng gói cẩn thận, vải mềm, form đẹp",2025-02-23
1398,chuột,5,positive,"đóng gói cẩn thận, pin trâu, dùng mượt cả ngày, sẽ ủng hộ tiếp",2025-10-05
1399,chuột,4,positive,"pin trâu, dùng mượt cả ngày, sẽ ủng hộ tiếp",2025-11-23
1400,chuột,4,positive,"kết nối ổn định, không bị lag",2025-06-11
1401,chuột,3,neutral,săn sale nên thấy chưa dùng lâu nên chưa đánh giá thêm,2025-04-10
1402,tai nghe,3,neutral,"chưa test lâu nên chưa rõ độ bền, đáng tiền",2025-07-28
1403,giày thể thao,1,negative,"săn sale nên thấy size không chuẩn, hơi tiếc",2025-10-28
1404,nồi chiên,3,neutral,"săn sale nên thấy dùng ổn, cần test thêm",2026-03-30
1405,giày thể thao,4,positive,"shop giao nhanh, nhẹ chân, đúng size, sẽ ủng hộ tiếp",2025-09-14
1406,sạc dự phòng,3,neutral,"đóng gói cẩn thận, dùng được, chưa thấy vấn đề, đáng tiền",2025-07-04
1407,sạc dự phòng,3,neutral,"săn sale nên thấy đúng mô tả nhưng chưa nổi bật, sẽ ủng hộ tiếp",2025-04-17
1408,sạc dự phòng,2,negative,"sạc vào rất chậm, sẽ ủng hộ tiếp",2026-01-28
1409,nồi chiên,4,positive,"săn sale nên thấy nướng nhanh, chín đều, đáng tiền",2025-03-28
1410,tai nghe,5,positive,đeo êm tai lâu không đau,2025-04-02
1411,giày thể thao,3,neutral,"săn sale nên thấy mẫu đẹp nhưng chưa thử chạy lâu, sẽ ủng hộ tiếp",2025-03-05
1412,sạc dự phòng,5,positive,"săn sale nên thấy thiết kế đẹp, cầm chắc tay",2025-12-15
1413,bàn phím,5,positive,"săn sale nên thấy gõ êm tay, led đẹp",2025-08-19
1414,tai nghe,3,neutral,"shop giao nhanh, chưa test lâu nên chưa rõ độ bền",2025-01-05
1415,bàn phím,3,neutral,"gõ ổn, chưa có gì nổi bật, hơi tiếc",2026-03-14
1416,chuột,5,positive,"săn sale nên thấy cầm vừa tay, phản hồi tốt, hơi tiếc",2025-11-25
1417,sạc dự phòng,3,neutral,"shop giao nhanh, dùng được, chưa thấy vấn đề",2025-07-23
1418,nồi chiên,5,positive,"đóng gói cẩn thận, nướng nhanh, chín đều, đáng tiền",2025-11-06
1419,áo thun,5,positive,"săn sale nên thấy mặc thoải mái, đường may chắc",2025-10-07
1420,bàn phím,3,neutral,đúng mô tả nhưng giao hơi lâu,2025-11-04
1421,nồi chiên,5,positive,"shop giao nhanh, máy chạy êm, dễ vệ sinh",2025-04-19
1422,nồi chiên,5,positive,"shop giao nhanh, máy chạy êm, dễ vệ sinh",2025-03-14
1423,chuột,4,positive,"săn sale nên thấy kết nối ổn định, không bị lag",2025-04-20
1424,giày thể thao,3,neutral,"săn sale nên thấy đi ổn, đúng giá tiền, đáng tiền",2026-01-21
1425,tai nghe,5,positive,săn sale nên thấy đeo êm tai lâu không đau,2025-12-19
1426,nồi chiên,5,positive,"dung tích lớn, rất tiện, hơi tiếc",2026-02-26
1427,chuột,1,negative,"đóng gói cẩn thận, pin yếu hơn mô tả, đáng tiền",2025-01-08
1428,bàn phím,3,neutral,"đúng mô tả nhưng giao hơi lâu, hơi tiếc",2025-05-15
1429,sạc dự phòng,1,negative,săn sale nên thấy máy hơi nóng khi sạc,2025-02-19
1430,chuột,4,positive,"pin trâu, dùng mượt cả ngày, hơi tiếc",2025-04-21
1431,tai nghe,4,positive,"đóng gói cẩn thận, đeo êm tai lâu không đau",2025-06-04
1432,tai nghe,2,negative,"săn sale nên thấy đeo hơi đau tai, hơi tiếc",2025-07-30
1433,tai nghe,5,positive,"shop giao nhanh, âm thanh rõ, bass tốt, hơi tiếc",2025-08-08
1434,tai nghe,4,positive,"đóng gói cẩn thận, đeo êm tai lâu không đau, hơi tiếc",2025-11-21
1435,tai nghe,1,negative,âm bị rè khi mở lớn,2025-11-12
1436,áo thun,4,positive,màu đẹp như hình,2025-12-08
1437,tai nghe,3,neutral,"nghe ổn trong tầm giá, hơi tiếc",2025-02-28
1438,bàn phím,3,neutral,"săn sale nên thấy đúng mô tả nhưng giao hơi lâu, hơi tiếc",2025-01-04
1439,tai nghe,3,neutral,"đóng gói cẩn thận, chưa test lâu nên chưa rõ độ bền, đáng tiền",2026-03-06
1440,nồi chiên,3,neutral,nấu được nhưng không quá nhanh,2025-01-14
1441,bàn phím,3,neutral,"gõ ổn, chưa có gì nổi bật, hơi tiếc",2025-05-04
1442,sạc dự phòng,3,neutral,"dùng được, chưa thấy vấn đề, hơi tiếc",2025-03-07
1443,giày thể thao,4,positive,"đế bám tốt, chạy thích, sẽ ủng hộ tiếp",2025-08-12
1444,bàn phím,4,positive,"keycap chắc chắn, build ngon, hơi tiếc",2026-03-08
1445,nồi chiên,1,negative,"shop giao nhanh, vỏ có vết xước",2025-02-17
1446,chuột,4,positive,"di chuột mượt, click nhạy, rất đáng tiền, hơi tiếc",2025-01-13
1447,giày thể thao,2,negative,"shop giao nhanh, keo dán chưa chắc, sẽ ủng hộ tiếp",2025-06-02
1448,bàn phím,2,negative,"led không đều màu, đáng tiền",2025-02-12
1449,bàn phím,1,negative,led không đều màu,2025-02-24
1450,bàn phím,4,positive,"săn sale nên thấy gõ êm tay, led đẹp, đáng tiền",2026-03-06
1451,bàn phím,5,positive,"switch phản hồi tốt, rất thích, hơi tiếc",2025-11-17
1452,chuột,5,positive,"săn sale nên thấy cầm vừa tay, phản hồi tốt, sẽ ủng hộ tiếp",2025-04-03
1453,tai nghe,4,positive,"đóng gói cẩn thận, âm thanh rõ, bass tốt, đáng tiền",2025-09-05
1454,sạc dự phòng,1,negative,"đóng gói cẩn thận, máy hơi nóng khi sạc",2025-04-09
1455,sạc dự phòng,4,positive,"đóng gói cẩn thận, sạc nhanh, pin đúng dung lượng",2026-04-06
1456,bàn phím,4,positive,"shop giao nhanh, gõ êm tay, led đẹp, đáng tiền",2025-05-21
1457,áo thun,4,positive,"màu đẹp như hình, đáng tiền",2025-08-28
1458,giày thể thao,3,neutral,"đóng gói cẩn thận, đi ổn, đúng giá tiền, sẽ ủng hộ tiếp",2025-04-12
1459,giày thể thao,3,neutral,"đi ổn, đúng giá tiền",2025-06-09
1460,bàn phím,3,neutral,săn sale nên thấy đúng mô tả nhưng giao hơi lâu,2026-01-18
1461,tai nghe,3,neutral,"shop giao nhanh, nghe ổn trong tầm giá",2025-06-30
1462,tai nghe,3,neutral,âm thanh ở mức chấp nhận được,2025-05-10
1463,sạc dự phòng,5,positive,"sạc nhanh, pin đúng dung lượng, sẽ ủng hộ tiếp",2026-02-19
1464,tai nghe,4,positive,"âm thanh rõ, bass tốt, sẽ ủng hộ tiếp",2025-12-03
1465,tai nghe,5,positive,"đóng gói cẩn thận, âm thanh rõ, bass tốt",2026-01-03
1466,tai nghe,5,positive,"mic thu âm rõ, gọi điện tốt, hơi tiếc",2025-05-26
1467,sạc dự phòng,4,positive,"đóng gói cẩn thận, dùng ổn định, rất hài lòng",2026-03-29
1468,nồi chiên,3,neutral,"săn sale nên thấy đúng mô tả, mức trung bình, đáng tiền",2026-02-21
1469,tai nghe,4,positive,"đeo êm tai lâu không đau, đáng tiền",2025-08-04
1470,chuột,4,positive,"shop giao nhanh, kết nối ổn định, không bị lag",2025-01-11
1471,tai nghe,4,positive,"shop giao nhanh, đeo êm tai lâu không đau, hơi tiếc",2025-01-19
1472,sạc dự phòng,3,neutral,đúng mô tả nhưng chưa nổi bật,2025-08-29
1473,chuột,3,neutral,"đóng gói cẩn thận, chưa dùng lâu nên chưa đánh giá thêm, đáng tiền",2025-07-24
1474,chuột,2,negative,"săn sale nên thấy double click sau vài ngày, khá khó chịu, đáng tiền",2025-12-23
1475,áo thun,4,positive,màu đẹp như hình,2025-04-25
1476,chuột,3,neutral,"săn sale nên thấy chưa dùng lâu nên chưa đánh giá thêm, sẽ ủng hộ tiếp",2025-03-29
1477,chuột,5,positive,"đóng gói cẩn thận, di chuột mượt, click nhạy, rất đáng tiền",2025-02-26
1478,chuột,3,neutral,"chưa dùng lâu nên chưa đánh giá thêm, hơi tiếc",2025-05-19
1479,giày thể thao,4,positive,"shop giao nhanh, đi êm chân, form đẹp, đáng tiền",2026-03-18
1480,bàn phím,3,neutral,dùng văn phòng khá ổn,2025-09-28
1481,bàn phím,2,negative,"săn sale nên thấy led không đều màu, sẽ ủng hộ tiếp",2025-02-17
1482,tai nghe,3,neutral,"shop giao nhanh, chưa test lâu nên chưa rõ độ bền, sẽ ủng hộ tiếp",2025-12-22
1483,chuột,5,positive,"pin trâu, dùng mượt cả ngày, sẽ ủng hộ tiếp",2025-08-28
1484,nồi chiên,5,positive,"shop giao nhanh, máy chạy êm, dễ vệ sinh",2026-01-25
1485,sạc dự phòng,2,negative,"săn sale nên thấy máy hơi nóng khi sạc, sẽ ủng hộ tiếp",2026-03-11
1486,sạc dự phòng,4,positive,"săn sale nên thấy thiết kế đẹp, cầm chắc tay, hơi tiếc",2026-03-21
1487,sạc dự phòng,1,negative,"đóng gói cẩn thận, sạc vào rất chậm, hơi tiếc",2025-03-26
1488,giày thể thao,4,positive,"đế bám tốt, chạy thích",2025-05-04
1489,chuột,3,neutral,săn sale nên thấy dùng tạm ổn trong tầm giá,2025-08-20
1490,tai nghe,4,positive,"shop giao nhanh, đeo êm tai lâu không đau, sẽ ủng hộ tiếp",2025-07-23
1491,sạc dự phòng,5,positive,"đóng gói cẩn thận, thiết kế đẹp, cầm chắc tay, đáng tiền",2025-02-20
1492,chuột,1,negative,"shop giao nhanh, con lăn bị kẹt, trải nghiệm tệ, hơi tiếc",2025-04-01
1493,sạc dự phòng,5,positive,"sạc nhanh, pin đúng dung lượng, sẽ ủng hộ tiếp",2025-02-26
1494,bàn phím,4,positive,"gõ êm tay, led đẹp",2025-02-21
1495,tai nghe,5,positive,"đeo êm tai lâu không đau, sẽ ủng hộ tiếp",2026-01-11
1496,nồi chiên,3,neutral,"shop giao nhanh, dùng ổn, cần test thêm, sẽ ủng hộ tiếp",2025-06-27
1497,giày thể thao,5,positive,"shop giao nhanh, đi êm chân, form đẹp",2025-12-25
1498,sạc dự phòng,5,positive,"đóng gói cẩn thận, sạc nhanh, pin đúng dung lượng",2025-03-27
1499,bàn phím,5,positive,"săn sale nên thấy gõ êm tay, led đẹp, hơi tiếc",2025-06-21
1500,chuột,5,positive,"pin trâu, dùng mượt cả ngày",2025-06-30
1501,áo thun,1,negative,vải mỏng hơn mong đợi,2026-02-24
1502,chuột,1,negative,"shop giao nhanh, pin yếu hơn mô tả",2025-02-21
1503,tai nghe,3,neutral,"đóng gói cẩn thận, nghe ổn trong tầm giá",2025-05-12
1504,giày thể thao,5,positive,"đóng gói cẩn thận, đi êm chân, form đẹp, đáng tiền",2025-12-30
1505,tai nghe,3,neutral,nghe ổn trong tầm giá,2025-03-17
1506,áo thun,3,neutral,"đúng mô tả, chất vải bình thường, sẽ ủng hộ tiếp",2025-10-23
1507,giày thể thao,2,negative,"keo dán chưa chắc, sẽ ủng hộ tiếp",2025-07-13
1508,giày thể thao,5,positive,"shop giao nhanh, nhẹ chân, đúng size, đáng tiền",2025-12-14
1509,tai nghe,3,neutral,"đóng gói cẩn thận, nghe ổn trong tầm giá, sẽ ủng hộ tiếp",2025-01-22
1510,sạc dự phòng,1,negative,săn sale nên thấy dung lượng không như quảng cáo,2026-02-10
1511,nồi chiên,4,positive,"shop giao nhanh, máy chạy êm, dễ vệ sinh, hơi tiếc",2025-12-15
1512,bàn phím,1,negative,"săn sale nên thấy led không đều màu, đáng tiền",2025-02-03
1513,nồi chiên,5,positive,"đóng gói cẩn thận, nướng nhanh, chín đều",2025-03-05
1514,chuột,4,positive,"cầm vừa tay, phản hồi tốt",2025-05-09
1515,bàn phím,5,positive,"đóng gói cẩn thận, gõ êm tay, led đẹp, sẽ ủng hộ tiếp",2026-01-11
1516,bàn phím,4,positive,"gõ êm tay, led đẹp, hơi tiếc",2025-07-01
1517,bàn phím,3,neutral,"đúng mô tả nhưng giao hơi lâu, đáng tiền",2025-06-04
1518,sạc dự phòng,5,positive,"shop giao nhanh, dùng ổn định, rất hài lòng, sẽ ủng hộ tiếp",2025-05-09
1519,bàn phím,4,positive,"switch phản hồi tốt, rất thích, đáng tiền",2025-10-18
1520,giày thể thao,4,positive,"đế bám tốt, chạy thích, sẽ ủng hộ tiếp",2025-09-27
1521,áo thun,2,negative,"săn sale nên thấy vải mỏng hơn mong đợi, hơi tiếc",2025-08-04
1522,áo thun,4,positive,"shop giao nhanh, vải mềm, form đẹp",2025-06-04
1523,nồi chiên,5,positive,"dung tích lớn, rất tiện",2026-03-26
1524,tai nghe,5,positive,"đeo êm tai lâu không đau, hơi tiếc",2026-02-18
1525,nồi chiên,3,neutral,"dùng ổn, cần test thêm, đáng tiền",2026-03-01
1526,giày thể thao,4,positive,"săn sale nên thấy nhẹ chân, đúng size, đáng tiền",2026-03-19
1527,chuột,4,positive,"pin trâu, dùng mượt cả ngày, hơi tiếc",2025-03-11
1528,bàn phím,3,neutral,"đóng gói cẩn thận, dùng văn phòng khá ổn",2026-02-17
1529,áo thun,1,negative,"size bị lệch, mặc không vừa, sẽ ủng hộ tiếp",2025-11-06
1530,chuột,1,negative,"săn sale nên thấy double click sau vài ngày, khá khó chịu",2026-03-03
1531,sạc dự phòng,4,positive,"săn sale nên thấy thiết kế đẹp, cầm chắc tay, hơi tiếc",2025-04-05
1532,nồi chiên,5,positive,"dung tích lớn, rất tiện",2025-08-10
1533,bàn phím,1,negative,"shop giao nhanh, gõ hơi cứng và ồn, sẽ ủng hộ tiếp",2025-09-19
1534,giày thể thao,2,negative,"đóng gói cẩn thận, đi hơi cứng chân, đáng tiền",2025-12-08
1535,chuột,3,neutral,"đóng gói cẩn thận, đúng mô tả, hiệu năng bình thường, hơi tiếc",2025-07-17
1536,giày thể thao,3,neutral,"shop giao nhanh, mẫu đẹp nhưng chưa thử chạy lâu",2025-05-26
1537,áo thun,5,positive,"đóng gói cẩn thận, màu đẹp như hình",2025-11-27
1538,giày thể thao,3,neutral,"shop giao nhanh, mẫu đẹp nhưng chưa thử chạy lâu, hơi tiếc",2026-03-28
1539,giày thể thao,4,positive,"đế bám tốt, chạy thích",2025-04-18
1540,tai nghe,3,neutral,"shop giao nhanh, âm thanh ở mức chấp nhận được, đáng tiền",2025-12-02
1541,giày thể thao,1,negative,"đóng gói cẩn thận, đi hơi cứng chân, hơi tiếc",2025-02-04
1542,nồi chiên,2,negative,"shop giao nhanh, nhiệt không đều như mong đợi",2025-12-29
1543,sạc dự phòng,3,neutral,"đóng gói cẩn thận, đúng mô tả nhưng chưa nổi bật",2025-10-25
1544,tai nghe,1,negative,"âm bị rè khi mở lớn, sẽ ủng hộ tiếp",2025-04-29
1545,chuột,2,negative,"shop giao nhanh, con lăn bị kẹt, trải nghiệm tệ, sẽ ủng hộ tiếp",2025-02-23
1546,bàn phím,2,negative,một vài phím bị liệt,2025-05-09
1547,chuột,4,positive,"cầm vừa tay, phản hồi tốt",2025-03-31
1548,tai nghe,5,positive,"âm thanh rõ, bass tốt",2025-04-13
1549,bàn phím,5,positive,"shop giao nhanh, gõ êm tay, led đẹp, sẽ ủng hộ tiếp",2025-08-11
1550,nồi chiên,1,negative,nhiệt không đều như mong đợi,2025-04-15
1551,chuột,3,neutral,chưa dùng lâu nên chưa đánh giá thêm,2026-03-19
1552,chuột,5,positive,"pin trâu, dùng mượt cả ngày, hơi tiếc",2025-09-14
1553,tai nghe,4,positive,"săn sale nên thấy đeo êm tai lâu không đau, hơi tiếc",2026-03-24
1554,chuột,2,negative,"double click sau vài ngày, khá khó chịu, hơi tiếc",2025-04-29
1555,chuột,1,negative,"đóng gói cẩn thận, pin yếu hơn mô tả, đáng tiền",2025-07-19
1556,giày thể thao,4,positive,"đi êm chân, form đẹp",2025-05-04
1557,nồi chiên,2,negative,nhiệt không đều như mong đợi,2025-12-24
1558,chuột,1,negative,"đóng gói cẩn thận, double click sau vài ngày, khá khó chịu, hơi tiếc",2025-05-14
1559,bàn phím,4,positive,"gõ êm tay, led đẹp, đáng tiền",2026-01-23
1560,giày thể thao,3,neutral,mẫu đẹp nhưng chưa thử chạy lâu,2025-11-09
1561,giày thể thao,3,neutral,"săn sale nên thấy đi ổn, đúng giá tiền",2026-01-14
1562,sạc dự phòng,3,neutral,sạc ở mức bình thường,2025-01-19
1563,áo thun,2,negative,"đóng gói cẩn thận, vải mỏng hơn mong đợi, sẽ ủng hộ tiếp",2025-01-11
1564,chuột,4,positive,"di chuột mượt, click nhạy, rất đáng tiền, hơi tiếc",2025-01-27
1565,áo thun,3,neutral,săn sale nên thấy không quá xuất sắc nhưng chấp nhận được,2025-03-12
1566,chuột,5,positive,"đóng gói cẩn thận, pin trâu, dùng mượt cả ngày, hơi tiếc",2025-01-30
1567,bàn phím,4,positive,"switch phản hồi tốt, rất thích",2025-01-24
1568,nồi chiên,4,positive,"nướng nhanh, chín đều, sẽ ủng hộ tiếp",2025-08-13
1569,bàn phím,5,positive,"shop giao nhanh, keycap chắc chắn, build ngon, đáng tiền",2025-03-08
1570,sạc dự phòng,4,positive,"đóng gói cẩn thận, sạc nhanh, pin đúng dung lượng",2025-04-16
1571,áo thun,1,negative,"đóng gói cẩn thận, vải mỏng hơn mong đợi, đáng tiền",2026-02-04
1572,sạc dự phòng,4,positive,"thiết kế đẹp, cầm chắc tay",2025-02-23
1573,chuột,5,positive,"cầm vừa tay, phản hồi tốt, sẽ ủng hộ tiếp",2025-03-12
1574,nồi chiên,3,neutral,"đúng mô tả, mức trung bình, sẽ ủng hộ tiếp",2025-03-04
1575,tai nghe,1,negative,"săn sale nên thấy âm bị rè khi mở lớn, hơi tiếc",2025-02-28
1576,chuột,4,positive,"cầm vừa tay, phản hồi tốt, hơi tiếc",2025-06-03
1577,nồi chiên,3,neutral,"săn sale nên thấy đúng mô tả, mức trung bình, hơi tiếc",2025-01-10
1578,nồi chiên,5,positive,"shop giao nhanh, nướng nhanh, chín đều, hơi tiếc",2025-04-05
1579,giày thể thao,4,positive,"đi êm chân, form đẹp, đáng tiền",2025-01-14
1580,sạc dự phòng,3,neutral,"shop giao nhanh, đúng mô tả nhưng chưa nổi bật",2025-06-24
1581,giày thể thao,3,neutral,chất lượng bình thường,2025-10-11
1582,áo thun,3,neutral,"đúng mô tả, chất vải bình thường",2026-01-29
1583,sạc dự phòng,5,positive,"shop giao nhanh, dùng ổn định, rất hài lòng, sẽ ủng hộ tiếp",2025-01-08
1584,tai nghe,3,neutral,"âm thanh ở mức chấp nhận được, đáng tiền",2025-06-22
1585,sạc dự phòng,5,positive,"đóng gói cẩn thận, thiết kế đẹp, cầm chắc tay",2025-01-07
1586,chuột,5,positive,"săn sale nên thấy pin trâu, dùng mượt cả ngày, hơi tiếc",2025-01-09
1587,áo thun,4,positive,"mặc thoải mái, đường may chắc, sẽ ủng hộ tiếp",2025-07-29
1588,chuột,2,negative,"con lăn bị kẹt, trải nghiệm tệ, hơi tiếc",2025-04-03
1589,tai nghe,3,neutral,"shop giao nhanh, nghe ổn trong tầm giá, sẽ ủng hộ tiếp",2025-11-19
1590,bàn phím,4,positive,"gõ êm tay, led đẹp, sẽ ủng hộ tiếp",2025-12-17
1591,sạc dự phòng,3,neutral,"shop giao nhanh, đúng mô tả nhưng chưa nổi bật",2026-01-01
1592,tai nghe,3,neutral,chưa test lâu nên chưa rõ độ bền,2025-05-01
1593,tai nghe,5,positive,"mic thu âm rõ, gọi điện tốt, sẽ ủng hộ tiếp",2025-04-15
1594,tai nghe,1,negative,"săn sale nên thấy đeo hơi đau tai, đáng tiền",2025-03-15
1595,chuột,5,positive,"đóng gói cẩn thận, kết nối ổn định, không bị lag, hơi tiếc",2025-05-31
1596,sạc dự phòng,5,positive,"shop giao nhanh, thiết kế đẹp, cầm chắc tay",2025-01-14
1597,chuột,2,negative,săn sale nên thấy pin yếu hơn mô tả,2025-01-17
1598,giày thể thao,1,negative,"shop giao nhanh, keo dán chưa chắc",2025-09-15
1599,sạc dự phòng,1,negative,máy hơi nóng khi sạc,2025-08-30
1600,giày thể thao,2,negative,"shop giao nhanh, đi hơi cứng chân",2025-05-31
1601,bàn phím,5,positive,"đóng gói cẩn thận, switch phản hồi tốt, rất thích",2025-12-21
1602,bàn phím,5,positive,"đóng gói cẩn thận, gõ êm tay, led đẹp",2025-09-16
1603,chuột,3,neutral,"săn sale nên thấy chưa dùng lâu nên chưa đánh giá thêm, sẽ ủng hộ tiếp",2025-10-19
1604,nồi chiên,3,neutral,"nấu được nhưng không quá nhanh, sẽ ủng hộ tiếp",2025-11-07
1605,tai nghe,3,neutral,"âm thanh ở mức chấp nhận được, hơi tiếc",2025-08-04
1606,sạc dự phòng,3,neutral,"săn sale nên thấy dùng được, chưa thấy vấn đề",2025-03-27
1607,chuột,5,positive,"pin trâu, dùng mượt cả ngày, hơi tiếc",2025-01-13
1608,giày thể thao,4,positive,"nhẹ chân, đúng size, hơi tiếc",2025-08-05
1609,tai nghe,4,positive,"đóng gói cẩn thận, âm thanh rõ, bass tốt, đáng tiền",2025-10-30
1610,sạc dự phòng,1,negative,"đóng gói cẩn thận, máy hơi nóng khi sạc, hơi tiếc",2025-07-29
1611,giày thể thao,5,positive,"shop giao nhanh, đế bám tốt, chạy thích, sẽ ủng hộ tiếp",2026-01-06
1612,nồi chiên,1,negative,quạt hơi ồn,2025-07-09
1613,giày thể thao,2,negative,"shop giao nhanh, đi hơi cứng chân",2026-01-05
