review_id,product_category,rating,sentiment_label,review_text,date
1,giày thể thao,5,positive,"shop giao nhanh, đi êm chân, form đẹp",2025-12-13
2,giày thể thao,3,neutral,"đi ổn, đúng giá tiền",2025-04-22
3,bàn phím,1,negative,"gõ hơi cứng và ồn, hơi tiếc",2025-04-23
4,áo thun,1,negative,"săn sale nên thấy chỉ thừa nhiều, hơi thất vọng, đáng tiền",2025-05-23
5,bàn phím,5,positive,"săn sale nên thấy gõ êm tay, led đẹp",2025-07-03
6,nồi chiên,5,positive,"săn sale nên thấy dung tích lớn, rất tiện",2025-03-05
7,áo thun,5,positive,"shop giao nhanh, màu đẹp như hình",2025-01-24
8,giày thể thao,5,positive,"đi êm chân, form đẹp, hơi tiếc",2025-05-23
9,áo thun,1,negative,"đóng gói cẩn thận, vải mỏng hơn mong đợi, sẽ ủng hộ tiếp",2025-12-10
10,tai nghe,1,negative,"shop giao nhanh, đeo hơi đau tai, sẽ ủng hộ tiếp",2025-08-25
11,áo thun,4,positive,"shop giao nhanh, vải mềm, form đẹp",2026-02-17
12,tai nghe,4,positive,"đóng gói cẩn thận, mic thu âm rõ, gọi điện tốt, sẽ ủng hộ tiếp",2025-12-02
13,áo thun,5,positive,"shop giao nhanh, mặc thoải mái, đường may chắc, sẽ ủng hộ tiếp",2026-01-17
14,sạc dự phòng,2,negative,"shop giao nhanh, dung lượng không như quảng cáo, sẽ ủng hộ tiếp",2025-09-18
15,áo thun,4,positive,"shop giao nhanh, vải mềm, form đẹp, hơi tiếc",2025-11-02
16,chuột,5,positive,"di chuột mượt, click nhạy, rất đáng tiền",2026-01-20
17,tai nghe,3,neutral,"săn sale nên thấy nghe ổn trong tầm giá, sẽ ủng hộ tiếp",2025-08-21
18,chuột,3,neutral,"đúng mô tả, hiệu năng bình thường, đáng tiền",2026-03-07
19,giày thể thao,1,negative,"shop giao nhanh, đi hơi cứng chân",2026-02-03
20,sạc dự phòng,3,neutral,"dùng được, chưa thấy vấn đề, đáng tiền",2026-03-26
21,nồi chiên,3,neutral,"dùng ổn, cần test thêm",2025-02-13
22,giày thể thao,4,positive,"săn sale nên thấy đi êm chân, form đẹp",2025-03-26
23,tai nghe,1,negative,"shop giao nhanh, đeo hơi đau tai, đáng tiền",2025-07-24
24,giày thể thao,2,negative,"shop giao nhanh, keo dán chưa chắc, sẽ ủng hộ tiếp",2025-02-02
25,tai nghe,4,positive,"âm thanh rõ, bass tốt",2025-04-28
26,chuột,3,neutral,"shop giao nhanh, đúng mô tả, hiệu năng bình thường, đáng tiền",2025-12-09
27,áo thun,4,positive,"săn sale nên thấy vải mềm, form đẹp, hơi tiếc",2025-04-08
28,chuột,5,positive,"săn sale nên thấy kết nối ổn định, không bị lag, hơi tiếc",2026-03-19
29,giày thể thao,4,positive,"đóng gói cẩn thận, đế bám tốt, chạy thích",2025-05-08
30,bàn phím,5,positive,"shop giao nhanh, switch phản hồi tốt, rất thích, đáng tiền",2025-08-25
31,bàn phím,3,neutral,dùng văn phòng khá ổn,2025-11-30
32,sạc dự phòng,3,neutral,"săn sale nên thấy dùng được, chưa thấy vấn đề, hơi tiếc",2025-09-04
33,bàn phím,3,neutral,"đúng mô tả nhưng giao hơi lâu, hơi tiếc",2025-05-16
34,nồi chiên,3,neutral,"đúng mô tả, mức trung bình, hơi tiếc",2025-03-21
35,bàn phím,4,positive,"đóng gói cẩn thận, keycap chắc chắn, build ngon",2025-01-26
36,sạc dự phòng,4,positive,"dùng ổn định, rất hài lòng, sẽ ủng hộ tiếp",2025-02-05
37,sạc dự phòng,4,positive,"sạc nhanh, pin đúng dung lượng, sẽ ủng hộ tiếp",2025-10-24
38,sạc dự phòng,4,positive,"dùng ổn định, rất hài lòng",2025-09-25
39,tai nghe,3,neutral,"đóng gói cẩn thận, âm thanh ở mức chấp nhận được, hơi tiếc",2025-03-09
40,giày thể thao,2,negative,"keo dán chưa chắc, hơi tiếc",2025-11-15
41,sạc dự phòng,3,neutral,"đóng gói cẩn thận, đúng mô tả nhưng chưa nổi bật, sẽ ủng hộ tiếp",2025-06-28
42,chuột,3,neutral,săn sale nên thấy dùng tạm ổn trong tầm giá,2025-12-27
43,tai nghe,2,negative,"đeo hơi đau tai, sẽ ủng hộ tiếp",2025-05-16
44,chuột,3,neutral,"chưa dùng lâu nên chưa đánh giá thêm, sẽ ủng hộ tiếp",2026-01-03
45,tai nghe,5,positive,đeo êm tai lâu không đau,2025-11-21
46,áo thun,3,neutral,"shop giao nhanh, đúng mô tả, chất vải bình thường, đáng tiền",2025-03-24
47,giày thể thao,5,positive,"đi êm chân, form đẹp, sẽ ủng hộ tiếp",2025-10-07
48,chuột,3,neutral,"dùng tạm ổn trong tầm giá, đáng tiền",2025-07-06
49,nồi chiên,3,neutral,"shop giao nhanh, dùng ổn, cần test thêm",2025-07-01
50,nồi chiên,1,negative,"shop giao nhanh, quạt hơi ồn, sẽ ủng hộ tiếp",2026-03-28
51,áo thun,5,positive,"shop giao nhanh, màu đẹp như hình, đáng tiền",2025-03-23
52,nồi chiên,1,negative,"shop giao nhanh, vỏ có vết xước, sẽ ủng hộ tiếp",2026-02-23
53,áo thun,4,positive,"shop giao nhanh, vải mềm, form đẹp, hơi tiếc",2025-06-18
54,tai nghe,3,neutral,"chưa test lâu nên chưa rõ độ bền, hơi tiếc",2025-12-14
55,nồi chiên,1,negative,"shop giao nhanh, vỏ có vết xước",2025-05-16
56,chuột,5,positive,"săn sale nên thấy cầm vừa tay, phản hồi tốt",2025-09-19
57,chuột,4,positive,"săn sale nên thấy di chuột mượt, click nhạy, rất đáng tiền",2025-09-24
58,nồi chiên,2,negative,"vỏ có vết xước, đáng tiền",2025-11-16
59,tai nghe,2,negative,"đóng gói cẩn thận, đeo hơi đau tai, hơi tiếc",2025-06-17
60,áo thun,1,negative,"săn sale nên thấy vải mỏng hơn mong đợi, sẽ ủng hộ tiếp",2025-11-12
61,sạc dự phòng,4,positive,"shop giao nhanh, thiết kế đẹp, cầm chắc tay, hơi tiếc",2026-02-07
62,sạc dự phòng,2,negative,"săn sale nên thấy dung lượng không như quảng cáo, sẽ ủng hộ tiếp",2025-09-19
63,áo thun,3,neutral,"đúng mô tả, chất vải bình thường",2025-06-21
64,chuột,3,neutral,"shop giao nhanh, dùng tạm ổn trong tầm giá, sẽ ủng hộ tiếp",2025-01-13
65,chuột,5,positive,"săn sale nên thấy kết nối ổn định, không bị lag",2025-04-10
66,giày thể thao,2,negative,"shop giao nhanh, keo dán chưa chắc",2026-04-03
67,nồi chiên,3,neutral,"shop giao nhanh, dùng ổn, cần test thêm",2025-08-26
68,chuột,2,negative,săn sale nên thấy pin yếu hơn mô tả,2025-10-14
69,sạc dự phòng,5,positive,"săn sale nên thấy dùng ổn định, rất hài lòng, sẽ ủng hộ tiếp",2026-01-16
70,nồi chiên,5,positive,"đóng gói cẩn thận, dung tích lớn, rất tiện",2025-09-06
71,giày thể thao,5,positive,"đóng gói cẩn thận, nhẹ chân, đúng size, sẽ ủng hộ tiếp",2025-05-20
72,tai nghe,4,positive,"shop giao nhanh, âm thanh rõ, bass tốt, hơi tiếc",2025-12-22
73,bàn phím,2,negative,"đóng gói cẩn thận, led không đều màu",2025-08-27
74,áo thun,5,positive,màu đẹp như hình,2025-07-14
75,áo thun,5,positive,"săn sale nên thấy mặc thoải mái, đường may chắc",2026-01-18
76,giày thể thao,2,negative,"đóng gói cẩn thận, keo dán chưa chắc, hơi tiếc",2025-09-06
77,chuột,5,positive,"shop giao nhanh, kết nối ổn định, không bị lag",2025-10-01
78,chuột,3,neutral,"săn sale nên thấy đúng mô tả, hiệu năng bình thường, sẽ ủng hộ tiếp",2026-03-20
79,áo thun,5,positive,"shop giao nhanh, mặc thoải mái, đường may chắc, hơi tiếc",2025-06-17
80,tai nghe,3,neutral,"đóng gói cẩn thận, nghe ổn trong tầm giá",2025-08-29
81,chuột,2,negative,pin yếu hơn mô tả,2026-01-22
82,chuột,3,neutral,"shop giao nhanh, đúng mô tả, hiệu năng bình thường, sẽ ủng hộ tiếp",2025-03-06
83,áo thun,2,negative,"đóng gói cẩn thận, chỉ thừa nhiều, hơi thất vọng, đáng tiền",2025-03-27
84,sạc dự phòng,1,negative,dung lượng không như quảng cáo,2025-01-14
85,tai nghe,2,negative,"shop giao nhanh, đeo hơi đau tai",2025-10-31
86,giày thể thao,3,neutral,"đóng gói cẩn thận, chất lượng bình thường",2026-02-17
87,chuột,3,neutral,"săn sale nên thấy đúng mô tả, hiệu năng bình thường, đáng tiền",2025-02-05
88,sạc dự phòng,2,negative,"dung lượng không như quảng cáo, hơi tiếc",2025-07-05
89,giày thể thao,3,neutral,"shop giao nhanh, mẫu đẹp nhưng chưa thử chạy lâu",2025-11-30
90,tai nghe,2,negative,"pin tụt nhanh, đáng tiền",2025-06-15
91,nồi chiên,4,positive,"shop giao nhanh, máy chạy êm, dễ vệ sinh, hơi tiếc",2025-10-19
92,sạc dự phòng,1,negative,"đóng gói cẩn thận, dung lượng không như quảng cáo, sẽ ủng hộ tiếp",2025-09-07
93,bàn phím,5,positive,"switch phản hồi tốt, rất thích, đáng tiền",2025-10-12
94,chuột,1,negative,"săn sale nên thấy pin yếu hơn mô tả, hơi tiếc",2025-10-12
95,nồi chiên,5,positive,"máy chạy êm, dễ vệ sinh",2025-05-31
96,bàn phím,4,positive,"keycap chắc chắn, build ngon, đáng tiền",2025-08-31
97,sạc dự phòng,2,negative,"săn sale nên thấy dung lượng không như quảng cáo, đáng tiền",2025-06-06
98,tai nghe,4,positive,"âm thanh rõ, bass tốt, sẽ ủng hộ tiếp",2025-04-09
99,bàn phím,2,negative,"shop giao nhanh, một vài phím bị liệt, đáng tiền",2025-04-27
100,tai nghe,4,positive,đeo êm tai lâu không đau,2025-10-11
101,tai nghe,2,negative,âm bị rè khi mở lớn,2025-05-26
102,áo thun,5,positive,"đóng gói cẩn thận, vải mềm, form đẹp, hơi tiếc",2025-02-28
103,nồi chiên,5,positive,"dung tích lớn, rất tiện, sẽ ủng hộ tiếp",2025-03-18
104,nồi chiên,1,negative,quạt hơi ồn,2026-01-27
105,áo thun,2,negative,"săn sale nên thấy vải mỏng hơn mong đợi, đáng tiền",2026-03-17
106,sạc dự phòng,3,neutral,"đúng mô tả nhưng chưa nổi bật, sẽ ủng hộ tiếp",2025-11-17
107,bàn phím,4,positive,"shop giao nhanh, gõ êm tay, led đẹp",2025-02-08
108,bàn phím,5,positive,"switch phản hồi tốt, rất thích, sẽ ủng hộ tiếp",2025-05-28
109,giày thể thao,5,positive,"shop giao nhanh, nhẹ chân, đúng size, đáng tiền",2026-02-08
110,nồi chiên,2,negative,"quạt hơi ồn, sẽ ủng hộ tiếp",2025-11-28
111,bàn phím,3,neutral,"shop giao nhanh, gõ ổn, chưa có gì nổi bật, đáng tiền",2025-11-01
112,giày thể thao,3,neutral,"săn sale nên thấy đi ổn, đúng giá tiền, đáng tiền",2025-12-25
113,áo thun,3,neutral,mặc tạm ổn,2026-04-01
114,áo thun,1,negative,"shop giao nhanh, size bị lệch, mặc không vừa",2025-10-28
115,chuột,3,neutral,săn sale nên thấy dùng tạm ổn trong tầm giá,2025-11-30
116,áo thun,3,neutral,săn sale nên thấy không quá xuất sắc nhưng chấp nhận được,2025-08-29
117,tai nghe,5,positive,"đóng gói cẩn thận, âm thanh rõ, bass tốt, hơi tiếc",2025-12-22
118,áo thun,5,positive,"mặc thoải mái, đường may chắc, đáng tiền",2025-05-10
119,tai nghe,5,positive,"mic thu âm rõ, gọi điện tốt, hơi tiếc",2025-07-31
120,chuột,5,positive,"kết nối ổn định, không bị lag, sẽ ủng hộ tiếp",2025-05-17
121,sạc dự phòng,5,positive,"săn sale nên thấy dùng ổn định, rất hài lòng",2025-01-15
122,giày thể thao,1,negative,đi hơi cứng chân,2025-10-10
123,áo thun,4,positive,"shop giao nhanh, vải mềm, form đẹp, hơi tiếc",2026-01-02
124,tai nghe,2,negative,"săn sale nên thấy pin tụt nhanh, sẽ ủng hộ tiếp",2025-08-22
125,sạc dự phòng,4,positive,"đóng gói cẩn thận, sạc nhanh, pin đúng dung lượng, hơi tiếc",2025-06-24
126,nồi chiên,2,negative,"đóng gói cẩn thận, nhiệt không đều như mong đợi",2025-10-24
127,giày thể thao,4,positive,"săn sale nên thấy nhẹ chân, đúng size, đáng tiền",2025-06-20
128,sạc dự phòng,3,neutral,"shop giao nhanh, sạc ở mức bình thường, sẽ ủng hộ tiếp",2025-10-20
129,áo thun,5,positive,"săn sale nên thấy mặc thoải mái, đường may chắc, hơi tiếc",2025-07-17
130,giày thể thao,3,neutral,"shop giao nhanh, đi ổn, đúng giá tiền",2025-10-30
131,tai nghe,3,neutral,săn sale nên thấy chưa test lâu nên chưa rõ độ bền,2026-01-05
132,bàn phím,4,positive,"đóng gói cẩn thận, switch phản hồi tốt, rất thích, đáng tiền",2025-11-16
133,giày thể thao,4,positive,"nhẹ chân, đúng size, hơi tiếc",2025-06-12
134,giày thể thao,1,negative,"size không chuẩn, sẽ ủng hộ tiếp",2025-11-20
135,giày thể thao,3,neutral,mẫu đẹp nhưng chưa thử chạy lâu,2025-08-16
136,bàn phím,1,negative,"led không đều màu, đáng tiền",2025-07-03
137,tai nghe,4,positive,"shop giao nhanh, mic thu âm rõ, gọi điện tốt, sẽ ủng hộ tiếp",2025-03-31
138,chuột,1,negative,"kết nối chập chờn, dùng bực mình, sẽ ủng hộ tiếp",2025-04-29
139,áo thun,2,negative,"chỉ thừa nhiều, hơi thất vọng, hơi tiếc",2025-05-28
140,giày thể thao,2,negative,"đi hơi cứng chân, đáng tiền",2025-11-24
141,áo thun,2,negative,"săn sale nên thấy size bị lệch, mặc không vừa, hơi tiếc",2025-02-24
142,bàn phím,5,positive,"đóng gói cẩn thận, keycap chắc chắn, build ngon",2026-03-01
143,giày thể thao,4,positive,"săn sale nên thấy nhẹ chân, đúng size, đáng tiền",2026-02-02
144,nồi chiên,5,positive,"shop giao nhanh, dung tích lớn, rất tiện",2025-05-09
145,giày thể thao,3,neutral,"chất lượng bình thường, đáng tiền",2026-02-08
146,áo thun,5,positive,"đóng gói cẩn thận, vải mềm, form đẹp, đáng tiền",2026-01-18
147,áo thun,4,positive,"màu đẹp như hình, đáng tiền",2026-03-02
148,bàn phím,5,positive,"đóng gói cẩn thận, keycap chắc chắn, build ngon",2025-08-28
149,chuột,4,positive,"cầm vừa tay, phản hồi tốt, hơi tiếc",2025-01-08
150,tai nghe,2,negative,"đóng gói cẩn thận, đeo hơi đau tai",2025-07-15
151,nồi chiên,1,negative,"shop giao nhanh, nhiệt không đều như mong đợi, hơi tiếc",2025-01-13
152,sạc dự phòng,3,neutral,"đúng mô tả nhưng chưa nổi bật, hơi tiếc",2025-12-25
153,tai nghe,1,negative,"âm bị rè khi mở lớn, đáng tiền",2025-09-10
154,chuột,4,positive,"đóng gói cẩn thận, kết nối ổn định, không bị lag",2025-08-03
155,sạc dự phòng,2,negative,"máy hơi nóng khi sạc, hơi tiếc",2025-11-12
156,áo thun,3,neutral,"đóng gói cẩn thận, không quá xuất sắc nhưng chấp nhận được, sẽ ủng hộ tiếp",2025-08-16
157,áo thun,3,neutral,"đóng gói cẩn thận, không quá xuất sắc nhưng chấp nhận được",2025-11-27
158,tai nghe,5,positive,"săn sale nên thấy âm thanh rõ, bass tốt",2025-12-06
159,bàn phím,1,negative,"shop giao nhanh, led không đều màu, sẽ ủng hộ tiếp",2026-02-07
160,sạc dự phòng,4,positive,"đóng gói cẩn thận, sạc nhanh, pin đúng dung lượng, sẽ ủng hộ tiếp",2026-02-08
161,sạc dự phòng,4,positive,"đóng gói cẩn thận, dùng ổn định, rất hài lòng, sẽ ủng hộ tiếp",2025-02-26
162,giày thể thao,3,neutral,"shop giao nhanh, mẫu đẹp nhưng chưa thử chạy lâu",2025-06-15
163,chuột,4,positive,"kết nối ổn định, không bị lag",2026-01-17
164,chuột,5,positive,"kết nối ổn định, không bị lag, sẽ ủng hộ tiếp",2025-11-11
165,chuột,2,negative,"double click sau vài ngày, khá khó chịu, hơi tiếc",2026-03-10
166,áo thun,4,positive,săn sale nên thấy màu đẹp như hình,2026-04-06
167,chuột,4,positive,"đóng gói cẩn thận, pin trâu, dùng mượt cả ngày",2025-11-21
168,sạc dự phòng,2,negative,"máy hơi nóng khi sạc, đáng tiền",2025-08-21
169,sạc dự phòng,1,negative,"máy hơi nóng khi sạc, sẽ ủng hộ tiếp",2025-08-09
170,áo thun,3,neutral,"săn sale nên thấy đúng mô tả, chất vải bình thường, hơi tiếc",2026-01-09
171,chuột,5,positive,"shop giao nhanh, cầm vừa tay, phản hồi tốt, hơi tiếc",2025-02-04
172,chuột,3,neutral,"đóng gói cẩn thận, dùng tạm ổn trong tầm giá, sẽ ủng hộ tiếp",2025-10-12
173,chuột,1,negative,"đóng gói cẩn thận, kết nối chập chờn, dùng bực mình, hơi tiếc",2026-03-21
174,giày thể thao,5,positive,"đế bám tốt, chạy thích",2025-09-17
175,bàn phím,5,positive,"đóng gói cẩn thận, gõ êm tay, led đẹp",2025-07-08
176,chuột,3,neutral,"đúng mô tả, hiệu năng bình thường",2025-12-12
177,giày thể thao,1,negative,"đóng gói cẩn thận, keo dán chưa chắc, đáng tiền",2025-06-23
178,tai nghe,4,positive,"shop giao nhanh, âm thanh rõ, bass tốt",2025-02-16
179,giày thể thao,2,negative,"đóng gói cẩn thận, đi hơi cứng chân, sẽ ủng hộ tiếp",2025-07-09
180,tai nghe,1,negative,"shop giao nhanh, âm bị rè khi mở lớn",2025-01-26
181,giày thể thao,5,positive,"đế bám tốt, chạy thích, hơi tiếc",2025-08-01
182,tai nghe,4,positive,"đeo êm tai lâu không đau, đáng tiền",2025-12-14
183,giày thể thao,1,negative,săn sale nên thấy keo dán chưa chắc,2025-01-29
184,chuột,4,positive,"đóng gói cẩn thận, cầm vừa tay, phản hồi tốt, đáng tiền",2025-03-03
185,chuột,5,positive,"săn sale nên thấy pin trâu, dùng mượt cả ngày",2025-12-27
186,bàn phím,1,negative,"led không đều màu, hơi tiếc",2025-01-10
187,áo thun,3,neutral,"săn sale nên thấy không quá xuất sắc nhưng chấp nhận được, hơi tiếc",2025-05-29
188,chuột,5,positive,"đóng gói cẩn thận, kết nối ổn định, không bị lag",2025-08-12
189,nồi chiên,5,positive,"dung tích lớn, rất tiện, hơi tiếc",2026-03-22
190,tai nghe,2,negative,âm bị rè khi mở lớn,2025-11-21
191,chuột,2,negative,"shop giao nhanh, con lăn bị kẹt, trải nghiệm tệ, sẽ ủng hộ tiếp",2025-02-22
192,bàn phím,4,positive,"keycap chắc chắn, build ngon, sẽ ủng hộ tiếp",2026-01-31
193,giày thể thao,5,positive,"đóng gói cẩn thận, nhẹ chân, đúng size, sẽ ủng hộ tiếp",2025-08-14
194,chuột,5,positive,"đóng gói cẩn thận, di chuột mượt, click nhạy, rất đáng tiền",2025-02-07
195,tai nghe,4,positive,"đóng gói cẩn thận, đeo êm tai lâu không đau",2025-11-27
196,nồi chiên,3,neutral,nấu được nhưng không quá nhanh,2026-02-10
197,giày thể thao,3,neutral,"mẫu đẹp nhưng chưa thử chạy lâu, hơi tiếc",2025-09-14
198,bàn phím,3,neutral,đúng mô tả nhưng giao hơi lâu,2025-11-27
199,bàn phím,5,positive,"keycap chắc chắn, build ngon",2025-03-23
200,tai nghe,5,positive,"đóng gói cẩn thận, đeo êm tai lâu không đau",2025-01-27
201,nồi chiên,1,negative,vỏ có vết xước,2025-12-14
202,áo thun,4,positive,"vải mềm, form đẹp, sẽ ủng hộ tiếp",2025-06-29
203,tai nghe,3,neutral,"chưa test lâu nên chưa rõ độ bền, đáng tiền",2025-10-14
204,áo thun,1,negative,"chỉ thừa nhiều, hơi thất vọng",2025-11-27
205,giày thể thao,5,positive,"đóng gói cẩn thận, đế bám tốt, chạy thích, sẽ ủng hộ tiếp",2025-04-20
206,tai nghe,3,neutral,"shop giao nhanh, âm thanh ở mức chấp nhận được, sẽ ủng hộ tiếp",2025-02-09
207,tai nghe,3,neutral,"đóng gói cẩn thận, chưa test lâu nên chưa rõ độ bền",2025-03-09
208,sạc dự phòng,4,positive,"dùng ổn định, rất hài lòng, sẽ ủng hộ tiếp",2026-01-05
209,áo thun,5,positive,"mặc thoải mái, đường may chắc, đáng tiền",2026-01-21
210,giày thể thao,3,neutral,"săn sale nên thấy mẫu đẹp nhưng chưa thử chạy lâu, sẽ ủng hộ tiếp",2025-07-08
211,giày thể thao,3,neutral,săn sale nên thấy mẫu đẹp nhưng chưa thử chạy lâu,2025-09-28
212,áo thun,3,neutral,"đúng mô tả, chất vải bình thường, hơi tiếc",2026-03-24
213,tai nghe,1,negative,"pin tụt nhanh, sẽ ủng hộ tiếp",2025-05-20
214,áo thun,3,neutral,"shop giao nhanh, mặc tạm ổn, hơi tiếc",2026-03-29
215,tai nghe,3,neutral,"nghe ổn trong tầm giá, đáng tiền",2025-05-01
216,áo thun,3,neutral,"đóng gói cẩn thận, mặc tạm ổn",2026-03-06
217,giày thể thao,1,negative,"đóng gói cẩn thận, keo dán chưa chắc, hơi tiếc",2025-12-23
218,nồi chiên,5,positive,"dung tích lớn, rất tiện",2025-01-10
219,tai nghe,4,positive,"đóng gói cẩn thận, âm thanh rõ, bass tốt, sẽ ủng hộ tiếp",2025-06-04
220,chuột,5,positive,"di chuột mượt, click nhạy, rất đáng tiền, hơi tiếc",2025-11-02
221,sạc dự phòng,4,positive,"săn sale nên thấy thiết kế đẹp, cầm chắc tay",2025-11-11
222,tai nghe,5,positive,"mic thu âm rõ, gọi điện tốt",2025-07-04
223,chuột,3,neutral,"chưa dùng lâu nên chưa đánh giá thêm, hơi tiếc",2025-07-11
224,tai nghe,1,negative,"shop giao nhanh, pin tụt nhanh",2026-01-31
225,sạc dự phòng,1,negative,"đóng gói cẩn thận, sạc vào rất chậm",2025-06-23
226,nồi chiên,2,negative,"shop giao nhanh, nhiệt không đều như mong đợi, sẽ ủng hộ tiếp",2025-02-02
227,giày thể thao,3,neutral,"shop giao nhanh, mẫu đẹp nhưng chưa thử chạy lâu",2026-02-10
228,bàn phím,3,neutral,săn sale nên thấy dùng văn phòng khá ổn,2025-08-31
229,tai nghe,4,positive,"đeo êm tai lâu không đau, đáng tiền",2025-05-20
230,chuột,3,neutral,"săn sale nên thấy đúng mô tả, hiệu năng bình thường, hơi tiếc",2025-06-23
231,bàn phím,5,positive,"đóng gói cẩn thận, keycap chắc chắn, build ngon",2026-01-08
232,áo thun,4,positive,"mặc thoải mái, đường may chắc",2025-06-17
233,giày thể thao,5,positive,"săn sale nên thấy đi êm chân, form đẹp, đáng tiền",2025-08-17
234,chuột,2,negative,"con lăn bị kẹt, trải nghiệm tệ",2025-12-10
235,giày thể thao,4,positive,"đi êm chân, form đẹp, hơi tiếc",2025-01-18
236,bàn phím,5,positive,"switch phản hồi tốt, rất thích",2025-11-06
237,bàn phím,2,negative,led không đều màu,2025-03-12
238,sạc dự phòng,5,positive,"sạc nhanh, pin đúng dung lượng",2026-01-12
239,bàn phím,5,positive,"đóng gói cẩn thận, switch phản hồi tốt, rất thích, hơi tiếc",2025-04-20
240,sạc dự phòng,5,positive,"shop giao nhanh, sạc nhanh, pin đúng dung lượng",2025-08-20
241,bàn phím,3,neutral,"đóng gói cẩn thận, dùng văn phòng khá ổn, đáng tiền",2025-12-30
242,chuột,2,negative,"shop giao nhanh, pin yếu hơn mô tả, đáng tiền",2025-09-18
243,bàn phím,4,positive,"săn sale nên thấy gõ êm tay, led đẹp",2025-07-04
244,sạc dự phòng,1,negative,máy hơi nóng khi sạc,2025-06-08
245,áo thun,3,neutral,"đúng mô tả, chất vải bình thường",2025-03-06
246,tai nghe,2,negative,"đeo hơi đau tai, đáng tiền",2025-03-07
247,nồi chiên,3,neutral,nấu được nhưng không quá nhanh,2026-03-02
248,chuột,1,negative,"đóng gói cẩn thận, pin yếu hơn mô tả, sẽ ủng hộ tiếp",2025-06-27
249,sạc dự phòng,3,neutral,"dùng được, chưa thấy vấn đề, đáng tiền",2025-03-06
250,giày thể thao,4,positive,"nhẹ chân, đúng size, sẽ ủng hộ tiếp",2025-03-29
251,giày thể thao,1,negative,keo dán chưa chắc,2025-11-25
252,nồi chiên,2,negative,"nhiệt không đều như mong đợi, hơi tiếc",2026-04-01
253,giày thể thao,2,negative,"săn sale nên thấy keo dán chưa chắc, đáng tiền",2025-08-21
254,chuột,2,negative,"săn sale nên thấy kết nối chập chờn, dùng bực mình, hơi tiếc",2025-04-15
255,tai nghe,2,negative,"đóng gói cẩn thận, đeo hơi đau tai, hơi tiếc",2025-03-08
256,nồi chiên,4,positive,"săn sale nên thấy nướng nhanh, chín đều",2025-05-17
257,áo thun,4,positive,"săn sale nên thấy mặc thoải mái, đường may chắc",2025-08-03
258,bàn phím,3,neutral,"đóng gói cẩn thận, dùng văn phòng khá ổn, sẽ ủng hộ tiếp",2026-01-26
259,bàn phím,5,positive,"săn sale nên thấy switch phản hồi tốt, rất thích",2025-02-16
260,áo thun,1,negative,"đóng gói cẩn thận, chỉ thừa nhiều, hơi thất vọng",2025-01-26
261,tai nghe,5,positive,"mic thu âm rõ, gọi điện tốt",2025-08-09
262,bàn phím,3,neutral,"đúng mô tả nhưng giao hơi lâu, hơi tiếc",2025-01-27
263,sạc dự phòng,2,negative,săn sale nên thấy sạc vào rất chậm,2025-08-19
264,nồi chiên,1,negative,"săn sale nên thấy quạt hơi ồn, đáng tiền",2026-02-11
265,tai nghe,1,negative,âm bị rè khi mở lớn,2025-07-25
266,sạc dự phòng,4,positive,"đóng gói cẩn thận, dùng ổn định, rất hài lòng, hơi tiếc",2025-09-23
267,áo thun,4,positive,"đóng gói cẩn thận, màu đẹp như hình, sẽ ủng hộ tiếp",2025-07-21
268,sạc dự phòng,2,negative,máy hơi nóng khi sạc,2025-09-08
269,giày thể thao,1,negative,"đóng gói cẩn thận, đi hơi cứng chân",2025-08-02
270,sạc dự phòng,4,positive,"thiết kế đẹp, cầm chắc tay",2025-04-27
271,giày thể thao,5,positive,"nhẹ chân, đúng size, hơi tiếc",2025-03-17
272,nồi chiên,1,negative,"quạt hơi ồn, hơi tiếc",2025-06-10
